{
  "$schema": "http://json-schema.org/draft-07/schema#",
  "$id": "cliente.schema.json",
  "title": "Cliente",
  "type": "object",
  "properties": {
    "clienteId": { "type": "string" },
    "nombreCompleto": { "type": "string" },
    "email": { "type": "string", "format": "email" },
    "telefono": { "type": "string" },
    "ubicacionId": { "type": "string" },
    "tipoForfait": { "type": "string" },
    "saldoMonedero": { "type": "number" }
  },
  "required": ["clienteId", "nombreCompleto", "email", "ubicacionId"],
  "additionalProperties": false
}
