[
  { "clienteId": "C001", "nombreCompleto": "Ana García López", "email": "ana.garcia@example.com", "telefono": "+34 612345678", "tipoForfait": "Temporada", "saldoMonedero": 120.5, "ubicacionId": "ZonaPrincipiantes" },
  { "clienteId": "C002", "nombreCompleto": "Javier Pérez Ramos", "email": "javier.perez@example.com", "telefono": "+34 623456789", "tipoForfait": "Diario", "saldoMonedero": 45, "ubicacionId": "ZonaExpertos" },
  { "clienteId": "C003", "nombreCompleto": "María Fernández Ruiz", "email": "maria.fernandez@example.com", "telefono": "+34 634567890", "tipoForfait": "Temporada", "saldoMonedero": 210.75, "ubicacionId": "ZonaPrincipiantes" },
  { "clienteId": "C004", "nombreCompleto": "Carlos Romero Díaz", "email": "carlos.romero@example.com", "telefono": "+34 645678901", "tipoForfait": "Diario", "saldoMonedero": 65.3, "ubicacionId": "ZonaInfantil" },
  { "clienteId": "C005", "nombreCompleto": "Lucía Navarro Gómez", "email": "lucia.navarro@example.com", "telefono": "+34 656789012", "tipoForfait": "Temporada", "saldoMonedero": 180, "ubicacionId": "ZonaExpertos" },
  { "clienteId": "C006", "nombreCompleto": "Pedro Martín Soto", "email": "pedro.martin@example.com", "telefono": "+34 667890123", "tipoForfait": "Diario", "saldoMonedero": 55, "ubicacionId": "ZonaPrincipiantes" },
  { "clienteId": "C007", "nombreCompleto": "Laura Sánchez Vega", "email": "laura.sanchez@example.com", "telefono": "+34 678901234", "tipoForfait": "Temporada", "saldoMonedero": 130.25, "ubicacionId": "ZonaInfantil" },
  { "clienteId": "C008", "nombreCompleto": "Miguel Torres Blanco", "email": "miguel.torres@example.com", "telefono": "+34 689012345", "tipoForfait": "Diario", "saldoMonedero": 95.4, "ubicacionId": "ZonaExpertos" },
  { "clienteId": "C009", "nombreCompleto": "Sara Díaz Campos", "email": "sara.diaz@example.com", "telefono": "+34 690123456", "tipoForfait": "Temporada", "saldoMonedero": 200, "ubicacionId": "ZonaPrincipiantes" },
  { "clienteId": "C010", "nombreCompleto": "David Alonso Cruz", "email": "david.alonso@example.com", "telefono": "+34 691234567", "tipoForfait": "Diario", "saldoMonedero": 40, "ubicacionId": "ZonaInfantil" },
  { "clienteId": "C011", "nombreCompleto": "Nuria Jiménez Ortiz", "email": "nuria.jimenez@example.com", "telefono": "+34 692345678", "tipoForfait": "Temporada", "saldoMonedero": 88.9, "ubicacionId": "ZonaExpertos" },
  { "clienteId": "C012", "nombreCompleto": "Álvaro Ruiz Moreno", "email": "alvaro.ruiz@example.com", "telefono": "+34 693456789", "tipoForfait": "Diario", "saldoMonedero": 74.5, "ubicacionId": "ZonaPrincipiantes" },
  { "clienteId": "C013", "nombreCompleto": "Elena Castro León", "email": "elena.castro@example.com", "telefono": "+34 694567890", "tipoForfait": "Temporada", "saldoMonedero": 142.2, "ubicacionId": "UZonaInfantil" },
  { "clienteId": "C014", "nombreCompleto": "Sergio Molina Bravo", "email": "sergio.molina@example.com", "telefono": "+34 695678901", "tipoForfait": "Diario", "saldoMonedero": 59.7, "ubicacionId": "ZonaExpertos" },
  { "clienteId": "C015", "nombreCompleto": "Marta León Cano", "email": "marta.leon@example.com", "telefono": "+34 696789012", "tipoForfait": "Temporada", "saldoMonedero": 150.3, "ubicacionId": "ZonaPrincipiantes" },
  { "clienteId": "C016", "nombreCompleto": "Adrián Ortega Herrera", "email": "adrian.ortega@example.com", "telefono": "+34 697890123", "tipoForfait": "Diario", "saldoMonedero": 65.9, "ubicacionId": "ZonaExpertos" },
  { "clienteId": "C017", "nombreCompleto": "Patricia Rubio Serrano", "email": "patricia.rubio@example.com", "telefono": "+34 698901234", "tipoForfait": "Temporada", "saldoMonedero": 190, "ubicacionId": "ZonaInfantil" },
  { "clienteId": "C018", "nombreCompleto": "Diego Castro Gil", "email": "diego.castro@example.com", "telefono": "+34 699012345", "tipoForfait": "Diario", "saldoMonedero": 85.6, "ubicacionId": "ZonaPrincipiantes" },
  { "clienteId": "C019", "nombreCompleto": "Cristina Ramos Rubio", "email": "cristina.ramos@example.com", "telefono": "+34 610123456", "tipoForfait": "Temporada", "saldoMonedero": 210, "ubicacionId": "ZonaExpertos" },
  { "clienteId": "C020", "nombreCompleto": "Andrés López Martín", "email": "andres.lopez@example.com", "telefono": "+34 611234567", "tipoForfait": "Diario", "saldoMonedero": 40.4, "ubicacionId": "ZonaInfantil" },
  { "clienteId": "C021", "nombreCompleto": "Isabel Vega Torres", "email": "isabel.vega@example.com", "telefono": "+34 612345679", "tipoForfait": "Temporada", "saldoMonedero": 178.8, "ubicacionId": "ZonaExpertos" },
  { "clienteId": "C022", "nombreCompleto": "Francisco Díaz Marín", "email": "francisco.diaz@example.com", "telefono": "+34 613456780", "tipoForfait": "Diario", "saldoMonedero": 66.7, "ubicacionId": "ZonaPrincipiantes" },
  { "clienteId": "C023", "nombreCompleto": "Beatriz Alonso Santos", "email": "beatriz.alonso@example.com", "telefono": "+34 614567891", "tipoForfait": "Temporada", "saldoMonedero": 189.4, "ubicacionId": "ZonaInfantil" },
  { "clienteId": "C024", "nombreCompleto": "Raúl García Suárez", "email": "raul.garcia@example.com", "telefono": "+34 615678902", "tipoForfait": "Diario", "saldoMonedero": 75.3, "ubicacionId": "ZonaExpertos" },
  { "clienteId": "C025", "nombreCompleto": "Alicia Moreno Cabrera", "email": "alicia.moreno@example.com", "telefono": "+34 616789013", "tipoForfait": "Temporada", "saldoMonedero": 199.5, "ubicacionId": "ZonaPrincipiantes" },
  { "clienteId": "C026", "nombreCompleto": "Pablo Pérez Gil", "email": "pablo.perez@example.com", "telefono": "+34 617890124", "tipoForfait": "Diario", "saldoMonedero": 60.5, "ubicacionId": "ZonaExpertos" },
  { "clienteId": "C027", "nombreCompleto": "Eva Ortiz Hernández", "email": "eva.ortiz@example.com", "telefono": "+34 618901235", "tipoForfait": "Temporada", "saldoMonedero": 185.8, "ubicacionId": "ZonaInfantil" },
  { "clienteId": "C028", "nombreCompleto": "Rubén Iglesias Cruz", "email": "ruben.iglesias@example.com", "telefono": "+34 619012346", "tipoForfait": "Diario", "saldoMonedero": 68, "ubicacionId": "ZonaPrincipiantes" },
  { "clienteId": "C029", "nombreCompleto": "Irene López Fuentes", "email": "irene.lopez@example.com", "telefono": "+34 620123457", "tipoForfait": "Temporada", "saldoMonedero": 162.4, "ubicacionId": "ZonaExpertos" },
  { "clienteId": "C030", "nombreCompleto": "Óscar Ramos Díaz", "email": "oscar.ramos@example.com", "telefono": "+34 621234568", "tipoForfait": "Diario", "saldoMonedero": 52.9, "ubicacionId": "ZonaInfantil" },
  { "clienteId": "C031", "nombreCompleto": "Carmen Navarro Pardo", "email": "carmen.navarro@example.com", "telefono": "+34 622345679", "tipoForfait": "Temporada", "saldoMonedero": 143.7, "ubicacionId": "ZonaPrincipiantes" },
  { "clienteId": "C032", "nombreCompleto": "Iván García Molina", "email": "ivan.garcia@example.com", "telefono": "+34 623456790", "tipoForfait": "Diario", "saldoMonedero": 63.4, "ubicacionId": "ZonaExpertos" },
  { "clienteId": "C033", "nombreCompleto": "Natalia Pérez Cordero", "email": "natalia.perez@example.com", "telefono": "+34 624567801", "tipoForfait": "Temporada", "saldoMonedero": 158.6, "ubicacionId": "ZonaInfantil" },
  { "clienteId": "C034", "nombreCompleto": "Héctor Gil Lozano", "email": "hector.gil@example.com", "telefono": "+34 625678912", "tipoForfait": "Diario", "saldoMonedero": 77.5, "ubicacionId": "ZonaPrincipiantes" },
  { "clienteId": "C035", "nombreCompleto": "Rocío Torres Peña", "email": "rocio.torres@example.com", "telefono": "+34 626789023", "tipoForfait": "Temporada", "saldoMonedero": 179.8, "ubicacionId": "ZonaExpertos" },
  { "clienteId": "C036", "nombreCompleto": "Tomás Fernández Vera", "email": "tomas.fernandez@example.com", "telefono": "+34 627890134", "tipoForfait": "Diario", "saldoMonedero": 69.2, "ubicacionId": "ZonaInfantil" },
  { "clienteId": "C037", "nombreCompleto": "Blanca Ramos Luna", "email": "blanca.ramos@example.com", "telefono": "+34 628901245", "tipoForfait": "Temporada", "saldoMonedero": 191.3, "ubicacionId": "ZonaPrincipiantes" },
  { "clienteId": "C038", "nombreCompleto": "Felipe Soto Arenas", "email": "felipe.soto@example.com", "telefono": "+34 629012356", "tipoForfait": "Diario", "saldoMonedero": 83, "ubicacionId": "ZonaExpertos" },
  { "clienteId": "C039", "nombreCompleto": "Paula Romero Vidal", "email": "paula.romero@example.com", "telefono": "+34 630123467", "tipoForfait": "Temporada", "saldoMonedero": 176, "ubicacionId": "ZonaInfantil" },
  { "clienteId": "C040", "nombreCompleto": "Jorge León Montes", "email": "jorge.leon@example.com", "telefono": "+34 631234578", "tipoForfait": "Diario", "saldoMonedero": 50.7, "ubicacionId": "ZonaPrincipiantes" },
  { "clienteId": "C041", "nombreCompleto": "Teresa Herrera Soto", "email": "teresa.herrera@example.com", "telefono": "+34 632345689", "tipoForfait": "Temporada", "saldoMonedero": 188.4, "ubicacionId": "ZonaExpertos" },
  { "clienteId": "C042", "nombreCompleto": "Manuel Gutiérrez Ramos", "email": "manuel.gutierrez@example.com", "telefono": "+34 633456790", "tipoForfait": "Diario", "saldoMonedero": 62.9, "ubicacionId": "ZonaInfantil" },
  { "clienteId": "C043", "nombreCompleto": "Sofía Morales Vidal", "email": "sofia.morales@example.com", "telefono": "+34 634567801", "tipoForfait": "Temporada", "saldoMonedero": 197.6, "ubicacionId": "ZonaPrincipiantes" },
  { "clienteId": "C044", "nombreCompleto": "Raquel Iglesias Lozano", "email": "raquel.iglesias@example.com", "telefono": "+34 635678912", "tipoForfait": "Diario", "saldoMonedero": 74.8, "ubicacionId": "ZonaExpertos" },
  { "clienteId": "C045", "nombreCompleto": "Ignacio Torres Lara", "email": "ignacio.torres@example.com", "telefono": "+34 636789023", "tipoForfait": "Temporada", "saldoMonedero": 185.2, "ubicacionId": "ZonaInfantil" },
  { "clienteId": "C046", "nombreCompleto": "Cristina Peña Vargas", "email": "cristina.pena@example.com", "telefono": "+34 637890134", "tipoForfait": "Diario", "saldoMonedero": 64.1, "ubicacionId": "ZonaPrincipiantes" },